{
  "$schema": "https://json-schema.org/draft/2020-12/schema",
  "$id": "https://example.org/ai-zero-network/schemas/region-flow-v0.4.schema.json",
  "title": "AI Zero Network Region Flow v0.4",
  "description": "Schema for directional observable flow between two Zero Network Regions during a bounded observation window.",
  "type": "object",
  "additionalProperties": false,

  "required": [
    "schema_version",
    "flow_id",
    "source_region",
    "target_region",
    "window_start",
    "window_end",
    "observations"
  ],

  "properties": {
    "schema_version": {
      "type": "string",
      "const": "0.4"
    },

    "flow_id": {
      "type": "string",
      "format": "uuid",
      "description": "Unique identifier for this Region Flow observation."
    },

    "source_region": {
      "type": "string",
      "minLength": 1,
      "maxLength": 256,
      "description": "Region from which the observed flow originated."
    },

    "target_region": {
      "type": "string",
      "minLength": 1,
      "maxLength": 256,
      "description": "Region toward which the observed flow moved."
    },

    "window_start": {
      "type": "string",
      "format": "date-time",
      "description": "Inclusive start of the observation window."
    },

    "window_end": {
      "type": "string",
      "format": "date-time",
      "description": "End of the observation window. Semantic validation MUST confirm that it is later than window_start."
    },

    "observation_state": {
      "type": "string",
      "enum": [
        "complete",
        "partial",
        "provisional"
      ],
      "description": "Completeness state of this flow observation."
    },

    "observations": {
      "type": "object",
      "additionalProperties": false,
      "minProperties": 1,

      "properties": {
        "trace_count": {
          "type": "integer",
          "minimum": 0,
          "description": "Number of qualifying Trace transitions from source_region to target_region."
        },

        "receipt_count": {
          "type": "integer",
          "minimum": 0,
          "description": "Number of qualifying externally effective actions associated with this directional flow."
        },

        "message_count": {
          "type": "integer",
          "minimum": 0,
          "description": "Number of observable messages crossing from source_region to target_region."
        },

        "tool_call_count": {
          "type": "integer",
          "minimum": 0,
          "description": "Number of observable tool calls crossing the regional boundary."
        },

        "authority_transfer_count": {
          "type": "integer",
          "minimum": 0,
          "description": "Number of observable authority delegations or transfers associated with this directional flow."
        },

        "resource_flow": {
          "type": "object",
          "additionalProperties": false,
          "minProperties": 1,

          "properties": {
            "tokens": {
              "type": "integer",
              "minimum": 0,
              "description": "Observable token volume associated with the directional flow."
            },

            "cost": {
              "type": "number",
              "minimum": 0,
              "description": "Observable implementation-defined cost associated with the directional flow."
            },

            "compute_units": {
              "type": "number",
              "minimum": 0,
              "description": "Observable compute volume associated with the directional flow."
            }
          }
        }
      }
    },

    "derived": {
      "type": "object",
      "additionalProperties": false,

      "properties": {
        "flow_rate": {
          "$ref": "#/$defs/derivedMetric"
        },

        "effective_flow": {
          "$ref": "#/$defs/derivedMetric"
        }
      }
    },

    "provenance": {
      "type": "object",
      "additionalProperties": false,

      "properties": {
        "generated_at": {
          "type": "string",
          "format": "date-time"
        },

        "collector_id": {
          "type": "string",
          "minLength": 1,
          "maxLength": 256
        },

        "source_record_count": {
          "type": "integer",
          "minimum": 0
        },

        "source_digest": {
          "type": "string",
          "pattern": "^[a-fA-F0-9]{64}$"
        }
      }
    }
  },

  "$defs": {
    "derivedMetric": {
      "type": "object",
      "additionalProperties": false,
      "required": [
        "value",
        "method"
      ],

      "properties": {
        "value": {
          "type": "number",
          "minimum": 0
        },

        "method": {
          "type": "string",
          "minLength": 1,
          "maxLength": 256,
          "description": "Method used to derive the flow indicator."
        }
      }
    }
  }
}
