{
  "schema_version": "0.4",
  "flow_id": "44444444-4444-4444-8444-444444444444",
  "source_region": "research-01",
  "target_region": "tooling-01",
  "window_start": "2026-10-04T01:10:00+09:00",
  "window_end": "2026-10-04T01:15:00+09:00",
  "observation_state": "complete",
  "observations": {
    "trace_count": 75,
    "receipt_count": 12,
    "message_count": 44,
    "tool_call_count": 18,
    "authority_transfer_count": 3,
    "resource_flow": {
      "tokens": 18200,
      "cost": 1.21,
      "compute_units": 54.8
    }
  },
  "derived": {
    "flow_rate": {
      "value": 15,
      "method": "trace_count/per_minute"
    },
    "effective_flow": {
      "value": 2.4,
      "method": "receipt_count/per_minute"
    }
  },
  "provenance": {
    "generated_at": "2026-10-04T01:15:02+09:00",
    "collector_id": "collector-research-tooling-01",
    "source_record_count": 87,
    "source_digest": "aaaaaaaaaaaaaaaaaaaaaaaaaaaaaaaaaaaaaaaaaaaaaaaaaaaaaaaaaaaaaaaa"
  }
}
